CPU: ID 0x906e9, Processor Type 0x0, Family 0x6, Model 0x9e, Stepping 0x9
Northbridge: 8086:591f (unknown)
Southbridge: 8086:a143 (H110)
IGD: 8086:5912 (Intel(R) UHD Graphics 630)
Trying to reveal Primary to Sideband Bridge (P2SB),
let's hope the OS doesn't mind... done.
SBREG_BAR = 0xfd000000 (MEM)

Hiding Primary to Sideband Bridge (P2SB).

============= GPIOS =============

------- GPIO Community 0 -------

PCR Port ID: 0xaf0000

------- GPIO Group GPP_A -------
0x0400: 0x0000001884000502 GPP_A0       RCIN#               
0x0408: 0x0000301984000402 GPP_A1       LAD0                
0x0410: 0x0000301a84000402 GPP_A2       LAD1                
0x0418: 0x0000301b84000402 GPP_A3       LAD2                
0x0420: 0x0000301c84000402 GPP_A4       LAD3                
0x0428: 0x0000001d84000600 GPP_A5       LFRAME#             
0x0430: 0x0000001e84000400 GPP_A6       SERIRQ              
0x0438: 0x0000001f84000102 GPP_A7       GPIO                
0x0440: 0x0000002084000500 GPP_A8       CLKRUN#             
0x0448: 0x0000102184000600 GPP_A9       CLKOUT_LPC0         
0x0450: 0x0000102284000600 GPP_A10      CLKOUT_LPC1         
0x0458: 0x0000002384000102 GPP_A11      GPIO                
0x0460: 0x0000002484000102 GPP_A12      GPIO                
0x0468: 0x0000002544000600 GPP_A13      SUSWARN#/SUSPWRDNACK
0x0470: 0x0000002644000600 GPP_A14      SUS_STAT#           
0x0478: 0x0000302744000502 GPP_A15      SUS_ACK#            
0x0480: 0x0000002884000102 GPP_A16      GPIO                
0x0488: 0x0000002984000102 GPP_A17      GPIO                
0x0490: 0x0000002a84000102 GPP_A18      GPIO                
0x0498: 0x0000002b44000300 GPP_A19      GPIO                
0x04a0: 0x0000002c44000300 GPP_A20      GPIO                
0x04a8: 0x0000002d44000300 GPP_A21      GPIO                
0x04b0: 0x0000002e84000102 GPP_A22      GPIO                
0x04b8: 0x0000002f84000102 GPP_A23      GPIO                
------- GPIO Group GPP_B -------
0x04c0: 0x0000003084000100 GPP_B0       GPIO                
0x04c8: 0x0000003184000102 GPP_B1       GPIO                
0x04d0: 0x0000003284000102 GPP_B2       GPIO                
0x04d8: 0x0000003344000201 GPP_B3       GPIO                
0x04e0: 0x0000003484000502 GPP_B4       CPU_GP3             
0x04e8: 0x0000003584000100 GPP_B5       GPIO                
0x04f0: 0x0000003684000100 GPP_B6       GPIO                
0x04f8: 0x0000003744000300 GPP_B7       GPIO                
0x0500: 0x0000003844000300 GPP_B8       GPIO                
0x0508: 0x0000003984000100 GPP_B9       GPIO                
0x0510: 0x0000003a84000100 GPP_B10      GPIO                
0x0518: 0x0000003b84000102 GPP_B11      GPIO                
0x0520: 0x0000003c44000600 GPP_B12      SLP_S0#             
0x0528: 0x0000003d44000600 GPP_B13      PLTRST#             
0x0530: 0x0000103e84000600 GPP_B14      SPKR                
0x0538: 0x0000003f84000102 GPP_B15      GPIO                
0x0540: 0x0000004084000102 GPP_B16      GPIO                
0x0548: 0x0000004144000201 GPP_B17      GPIO                
0x0550: 0x0000004284000100 GPP_B18      GPIO                
0x0558: 0x0000004384000102 GPP_B19      GPIO                
0x0560: 0x0000004484000102 GPP_B20      GPIO                
0x0568: 0x0000004584000102 GPP_B21      GPIO                
0x0570: 0x0000004684000100 GPP_B22      GPIO                
0x0578: 0x0000104784000a01 GPP_B23      PCHHOT#             
------- GPIO Community 1 -------

PCR Port ID: 0xae0000

------- GPIO Group GPP_C -------
0x0400: 0x0000004844000502 GPP_C0       SMBCLK              
0x0408: 0x0000004944000502 GPP_C1       SMBDATA             
0x0410: 0x0000004a44000201 GPP_C2       GPIO                
0x0418: 0x0000004b44000502 GPP_C3       SML0CLK             
0x0420: 0x0000004c44000502 GPP_C4       SML0DATA            
0x0428: 0x0000004d84000100 GPP_C5       GPIO                
0x0430: 0xffffffffffffffff GPP_C6       RESERVED            
0x0438: 0xffffffffffffffff GPP_C7       RESERVED            
0x0440: 0x0000005084000502 GPP_C8       UART0_RXD           
0x0448: 0x0000005184000600 GPP_C9       UART0_TXD           
0x0450: 0x0000005284000600 GPP_C10      UART0_RTS#          
0x0458: 0x0000005384000502 GPP_C11      UART0_CTS#          
0x0460: 0x0000005484000102 GPP_C12      GPIO                
0x0468: 0x0000005584000102 GPP_C13      GPIO                
0x0470: 0x0000005684000102 GPP_C14      GPIO                
0x0478: 0x0000005784000102 GPP_C15      GPIO                
0x0480: 0x0000005884000100 GPP_C16      GPIO                
0x0488: 0x0000005984000100 GPP_C17      GPIO                
0x0490: 0x0000005a84000100 GPP_C18      GPIO                
0x0498: 0x0000005b84000100 GPP_C19      GPIO                
0x04a0: 0x0000005c84000502 GPP_C20      UART2_RXD           
0x04a8: 0x0000005d84000600 GPP_C21      UART2_TXD           
0x04b0: 0x0000005e84000600 GPP_C22      UART2_RTS#          
0x04b8: 0x0000005f40880102 GPP_C23      GPIO                
------- GPIO Group GPP_D -------
0x04c0: 0x00000060c4000200 GPP_D0       GPIO                
0x04c8: 0x0000006184000102 GPP_D1       GPIO                
0x04d0: 0x0000006284000102 GPP_D2       GPIO                
0x04d8: 0x0000006384000102 GPP_D3       GPIO                
0x04e0: 0x0000006484000102 GPP_D4       GPIO                
0x04e8: 0x0000006584000402 GPP_D5       I2S_SFRM            
0x04f0: 0x0000006684000600 GPP_D6       I2S_TXD             
0x04f8: 0x0000006784000502 GPP_D7       I2S_RXD             
0x0500: 0x0000006884000402 GPP_D8       I2S_SCLK            
0x0508: 0x0000006984000102 GPP_D9       GPIO                
0x0510: 0x0000006a84000102 GPP_D10      GPIO                
0x0518: 0x0000006b84000102 GPP_D11      GPIO                
0x0520: 0x0000006c84000102 GPP_D12      GPIO                
0x0528: 0x0000006d84000100 GPP_D13      GPIO                
0x0530: 0x0000006e84000100 GPP_D14      GPIO                
0x0538: 0x0000006f84000100 GPP_D15      GPIO                
0x0540: 0x0000007084000100 GPP_D16      GPIO                
0x0548: 0x0000007184000102 GPP_D17      GPIO                
0x0550: 0x0000007284000102 GPP_D18      GPIO                
0x0558: 0x0000307384000500 GPP_D19      DMIC_CLK0           
0x0560: 0x0000307484000500 GPP_D20      DMIC_DATA0          
0x0568: 0x0000007584000102 GPP_D21      GPIO                
0x0570: 0x0000007684000102 GPP_D22      GPIO                
0x0578: 0x0000007784000102 GPP_D23      GPIO                
------- GPIO Group GPP_E -------
0x0580: 0x0000301884000502 GPP_E0       SATAXPCIE0          
0x0588: 0x0000301984000502 GPP_E1       SATAXPCIE1          
0x0590: 0x0000301a84000502 GPP_E2       SATAXPCIE2          
0x0598: 0x0000001b84000502 GPP_E3       CPU_GP0             
0x05a0: 0x0000001c84000500 GPP_E4       SATA_DEVSLP0        
0x05a8: 0x0000001d84000500 GPP_E5       SATA_DEVSLP1        
0x05b0: 0x0000001e84000500 GPP_E6       SATA_DEVSLP2        
0x05b8: 0x0000001f84000102 GPP_E7       GPIO                
0x05c0: 0x0000002084000600 GPP_E8       SATA_LED#           
0x05c8: 0x0000002144000502 GPP_E9       USB_OC0#            
0x05d0: 0x0000002244000502 GPP_E10      USB_OC1#            
0x05d8: 0x0000002344000502 GPP_E11      USB_OC2#            
0x05e0: 0x0000002444000502 GPP_E12      USB_OC3#            
------- GPIO Group GPP_F -------
0x05e8: 0x0000002584000100 GPP_F0       GPIO                
0x05f0: 0x0000302684000502 GPP_F1       SATAXPCIE4          
0x05f8: 0x0000002744000300 GPP_F2       GPIO                
0x0600: 0x0000002884000100 GPP_F3       GPIO                
0x0608: 0x0000002984000100 GPP_F4       GPIO                
0x0610: 0x0000002a84000102 GPP_F5       GPIO                
0x0618: 0x0000002b84000102 GPP_F6       GPIO                
0x0620: 0x0000002c84000102 GPP_F7       GPIO                
0x0628: 0x0000002d84000102 GPP_F8       GPIO                
0x0630: 0x0000002e84000102 GPP_F9       GPIO                
0x0638: 0x0000002f80100102 GPP_F10      GPIO                
0x0640: 0x0000003084000102 GPP_F11      GPIO                
0x0648: 0x0000003180900102 GPP_F12      GPIO                
0x0650: 0x0000003280100102 GPP_F13      GPIO                
0x0658: 0x0000003340900102 GPP_F14      GPIO                
0x0660: 0x0000003444000502 GPP_F15      USB_OC4#            
0x0668: 0x0000003544000502 GPP_F16      USB_OC5#            
0x0670: 0x0000003644000502 GPP_F17      USB_OC6#            
0x0678: 0x0000003784000201 GPP_F18      GPIO                
0x0680: 0x0000003884000100 GPP_F19      GPIO                
0x0688: 0x0000003984000100 GPP_F20      GPIO                
0x0690: 0x0000003a84000100 GPP_F21      GPIO                
0x0698: 0x0000003b84000102 GPP_F22      GPIO                
0x06a0: 0x0000003c84000100 GPP_F23      GPIO                
------- GPIO Group GPP_G -------
0x06a8: 0x0000003d44000300 GPP_G0       GPIO                
0x06b0: 0x0000003e44000300 GPP_G1       GPIO                
0x06b8: 0x0000003f80800102 GPP_G2       GPIO                
0x06c0: 0x0000004080800102 GPP_G3       GPIO                
0x06c8: 0x0000004144000200 GPP_G4       GPIO                
0x06d0: 0x0000004244000300 GPP_G5       GPIO                
0x06d8: 0x0000004380800102 GPP_G6       GPIO                
0x06e0: 0x0000004444000300 GPP_G7       GPIO                
0x06e8: 0x0000004584000102 GPP_G8       GPIO                
0x06f0: 0x0000004684000100 GPP_G9       GPIO                
0x06f8: 0x0000004784000102 GPP_G10      GPIO                
0x0700: 0x0000004884000102 GPP_G11      GPIO                
0x0708: 0x0000004984000102 GPP_G12      GPIO                
0x0710: 0x0000004a84000201 GPP_G13      GPIO                
0x0718: 0x0000004b80800100 GPP_G14      GPIO                
0x0720: 0x0000004c84000200 GPP_G15      GPIO                
0x0728: 0x0000004d84000100 GPP_G16      GPIO                
0x0730: 0x0000004e84000102 GPP_G17      GPIO                
0x0738: 0x0000004f80100102 GPP_G18      GPIO                
0x0740: 0x0000005084000500 GPP_G19      SMI#                
0x0748: 0x0000005184000102 GPP_G20      GPIO                
0x0750: 0x0000005284000102 GPP_G21      GPIO                
0x0758: 0x0000005384000102 GPP_G22      GPIO                
0x0760: 0x0000005484000102 GPP_G23      GPIO                
------- GPIO Group GPP_H -------
0x0768: 0x0000005584000100 GPP_H0       GPIO                
0x0770: 0x0000005644000300 GPP_H1       GPIO                
0x0778: 0x0000005784000102 GPP_H2       GPIO                
0x0780: 0x0000005844000100 GPP_H3       GPIO                
0x0788: 0x0000005984000100 GPP_H4       GPIO                
0x0790: 0x0000005a84000100 GPP_H5       GPIO                
0x0798: 0x0000005b84000100 GPP_H6       GPIO                
0x07a0: 0x0000005c84000100 GPP_H7       GPIO                
0x07a8: 0x0000005d84000100 GPP_H8       GPIO                
0x07b0: 0x0000005e84000100 GPP_H9       GPIO                
0x07b8: 0x0000005f84000100 GPP_H10      GPIO                
0x07c0: 0x0000006084000100 GPP_H11      GPIO                
0x07c8: 0x0000006184000100 GPP_H12      GPIO                
0x07d0: 0x0000006280100102 GPP_H13      GPIO                
0x07d8: 0x0000006380100102 GPP_H14      GPIO                
0x07e0: 0x0000006480100102 GPP_H15      GPIO                
0x07e8: 0x0000006584000102 GPP_H16      GPIO                
0x07f0: 0x0000006684000201 GPP_H17      GPIO                
0x07f8: 0x0000006784000102 GPP_H18      GPIO                
0x0800: 0x0000006884000102 GPP_H19      GPIO                
0x0808: 0x0000006984000100 GPP_H20      GPIO                
0x0810: 0x0000006a84000102 GPP_H21      GPIO                
0x0818: 0x0000006b84000102 GPP_H22      GPIO                
0x0820: 0x0000006c04000102 GPP_H23      GPIO                
------- GPIO Community 2 -------

PCR Port ID: 0xad0000

-------- GPIO Group GPD --------
0x0400: 0x0000001884000102 GPD0         GPIO                
0x0408: 0x0000001904000200 GPD1         GPIO                
0x0410: 0x00003c1a00080602 GPD2         LAN_WAKE#           
0x0418: 0x0000301b04000502 GPD3         PWRBTN#             
0x0420: 0x0000001c04000600 GPD4         SLP_S3#             
0x0428: 0x0000001d04000600 GPD5         SLP_S4#             
0x0430: 0x0000001e84000102 GPD6         GPIO                
0x0438: 0x0000001f84000103 GPD7         GPIO                
0x0440: 0x0000002004000600 GPD8         SUSCLK              
0x0448: 0x0000002104000600 GPD9         SLP_WLAN#           
0x0450: 0x0000002204000600 GPD10        SLP_S5#             
0x0458: 0x0000002304000600 GPD11        LANPHYPC            
------- GPIO Community 3 -------

PCR Port ID: 0xac0000

------- GPIO Group GPP_I -------
0x0400: 0x0000006d84000500 GPP_I0       DDPB_HPD0           
0x0408: 0x0000006e84000502 GPP_I1       DDPC_HPD1           
0x0410: 0x0000006f84000502 GPP_I2       DDPD_HPD2           
0x0418: 0x0000007084000500 GPP_I3       DDPE_HPD3           
0x0420: 0x0000007184000100 GPP_I4       GPIO                
0x0428: 0x0000007284000502 GPP_I5       DDPB_CTRLCLK        
0x0430: 0x0000107384000502 GPP_I6       DDPB_CTRLDATA       
0x0438: 0x0000007484000500 GPP_I7       DDPC_CTRLCLK        
0x0440: 0x0000107584000500 GPP_I8       DDPC_CTRLDATA       
0x0448: 0x0000007684000500 GPP_I9       DDPD_CTRLCLK        
0x0450: 0x0000107784000500 GPP_I10      DDPD_CTRLDATA       


